{
  "protocol_version": "0.1.0",
  "profile": {
    "id": "swe-bench-verified-result",
    "version": "0.1.0"
  },
  "benchmark": {
    "protocol_version": "0.1.0",
    "profile": {
      "id": "swe-bench-verified-result",
      "version": "0.1.0"
    },
    "benchmark_family": "swe-bench-verified",
    "dataset": {
      "uri": "https://raw.githubusercontent.com/SWE-bench/experiments/2f15350cd32becc4569e0d826361048555b605c0/evaluation/verified/20240612_MASAI_gpt4o/results/results.json",
      "revision": "2f15350cd32becc4569e0d826361048555b605c0",
      "digest": "sha256:da1756a0cf869ad40bc549bd20686674426a221167a257431348974d8cf18a44"
    },
    "task": {
      "upstream_id": "astropy__astropy-14309"
    },
    "evaluator": {
      "release": "f7bbbb2ccdf479001d6467c9e34af59e44a840f9",
      "config_digest": "sha256:88fc500ebaf692a53457149cec24dcf82dfa2d48f98021a894a087d275f61df4"
    }
  },
  "raw_artifact": {
    "artifact_id": "artifact_swe-bench-upstream-result",
    "digest": "sha256:da1756a0cf869ad40bc549bd20686674426a221167a257431348974d8cf18a44"
  },
  "mapping": {
    "version": "0.1.0",
    "implementation_digest": "sha256:bde28d35aa6408c3ba84b53a13884bcca005e49db466c1793d7b2b0178992a71",
    "warnings": [
      "The published aggregate establishes only that this task appears in the resolved category; per-task patch and test-status fields are unavailable.",
      "Projection is source-attested from a published result; this project did not reproduce the run."
    ],
    "unmapped_fields": [
      "no_generation",
      "no_logs",
      "setup_failure",
      "unresolved"
    ]
  },
  "outcome": {
    "status": "completed",
    "resolved": true
  }
}
